{
  "$schema": "./wiki.config.schema.json",
  "title": "agenticbusiness.wiki",
  "tagline": "What mentors who have lived it would tell you about building a business that properly applies AI.",
  "url": "https://www.agenticbusiness.wiki",
  "organizationName": "SupersuitUp",
  "projectName": "agenticbusiness-wiki",
  "copyright": "agenticbusiness.wiki",
  "noindex": true,
  "description": "Mentor-sourced ground truth for principals building agentic businesses. A business is agentic when it applies AI to its highest and best use, multiplying its potential without hollowing out what makes it worth running."
}
